,text
400,You know what happens after you miss math class ? It starts adding up .
401,"I crossed a cell phone with a skunk , and now the service stinks ."
402,I hear the Sylvester Stallone Film Festival got off to a rocky start .
403,I wanted to bring a penguin home but my parents said that wasn ' t going to fly .
404,"He collects mouthwash bottles , and they ' re all in mint condition ."
405,Early nuclear experimenters discovered an element of surprise .
406,Multitasking = screwing up several things at once .
407,After Junior swallowed the watch he had to wait to pass the time .
408,"OLD AUTO MECHANICS never die , they just become exhausted ."
409,"If all goes well , you ' ve overlooked something !"
410,Two companies that manufactured rulers decided to align .
411,"Waiter , there are pennies in my soup ! ' ' Well , sir , you said you ' d stop eating here if there wasn ' t some change in the food . ' ' *"
412,"Hope for the best , but prepare for the worst ."
413,I tried to pack myself in a suitcase . I could hardly contain myself .
414,My name is Leo . A lion trainer .
415,The river crested when a factory spilled toothpaste into it .
416,"When video arcades switched to a system of tokens , there was no quarter asked or given ."
417,The Alpine Skiing competition started poorly and went downhill from there .
418,Deep calls to deep .
419,A young man married is a young man marred .
420,A gardening store owner who often called long distance for importing realized that talk and dirt aren ' t necessarily cheap .
421,"If you wear a blindfold at the shooting range , you won ' t know what you ' re missing ."
422,When a letter carrier became a hero they called him a deliverer .
423,"' ' I ' ve run out of wool , ' ' said Tom , knitting his brow ."
424,Lunatic asylum : where optimism most flourishes .
425,Librarians are always going by the book .
426,Cross the stream where it is shallowest .
427,The prospector didn ' t think his career would pan out .
428,To write with a broken pencil is pointless .
429,The ice at the rink has many ruts . I think the maintenance crew is slipping up .
430,There was a contest on a slippery rock slope . I won in a landslide .
431,"Doctor , doctor , I keep thinking I ' m a deck of cards . - I ' ll deal with you later . Next !"
432,"OLD FARMERS never die , they just turn into vegetables ."
433,When a priest makes a mistake in church it ' s a clerical error .
434,. . . So simple a child could do it ? Go find me a child !
435,What you sow is what you reap .
436,In the old days a suspended sentence was hanging .
437,The first time I got hold of a hang glider I had to wing it .
438,Curiosity killed the cat .
439,The coffee tasted like mud because it was ground a couple of minutes ago .
440,OLD DEANS never die they just lose their faculties .
441,Show me a baker who is on a roll and I ' ll show you someone sitting on a bun .
442,"OLD ELECTRICIANS never die , they just lose their potential ."
443,"Success comes in cans , failure comes in cant’s"
444,The spirit is willing but the flesh is weak .
445,She was only a Junkie ' s daughter but her crack was the best in town .
446,I know road rage is an awful thing but when someone bumped my car I just couldn ' t help it . I got out my camera and snapped at the offender .
447,The worth of a thing is what it will bring .
448,"She was only a Cattleman ' s daughter , but she couldn ' t keep her calves together ."
449,"Dogs wags their tails , not as much to you as to your bread ."
450,"I tried hard to get into vexillology , but , in the end , had to flag it away ."
451,An archaeologist ' s career ended in ruins .
452,"Any given program , once running , is obsolete ."
453,"OLD PRESIDENTS never die , they just go through their cabinets"
454,Who has not served cannot command .
455,SYSOP \ ' sis äp \ n : the person laughing as you type
456,"I ' ve spotted more blackbirds than you have , Tom crowed ."
457,"OLD TYPISTS never die , they just lose their justification ."
458,"No longer foster , no longer friend ."
459,Don ' t lend people money . It causes amnesia .
460,That government is best which governs least .
461,"I ' ll glue the sheets of wood back together , Tom replied ."
462,"Old lumberjacks never die , they just pine away ."
463,Early stone tools had many problems that were eventually ironed out .
464,Empty vessels make the most sound .
465,"To test a man ' s character , give him power ."
466,He was facinated by his new welding job . It was riveting .
467,Bridge tolls have increased significantly over a 5 year span .
468,Nothing is so smiple that it can ' t get screwed up .
469,Those who polish cars so that they shine work in a buffer zone .
470,One rotten apple will spoil the whole barrel .
471,None of you exist . The sysop types it all in . . .
472,"Did you see guys that Bob the ventriloquist hangs out with ? They ' re nothing special , just a bunch of dummies ."
473,One secret of success is to know how to deny yourself and other people .
474,One scabbed sheep mars the whole flock .
475,"Better to remain silent and be thought a fool , than to open your mouth and remove all doubt ."
476,Today is a good day for you to jump in a lake .
477,We were so poor when I was growing up we couldn ' t even afford to pay attention .
478,"When you give to god , you always get back change"
479,I ' m not paranoid ! Which of my enemies told you this ?
480,"I was going to buy some loose tea , but the price was too steep ."
481,The sergeant drank whiskey in order to be fortified in his position .
482,"OLD COUPON CLIPPERS never die , they just expire ."
483,Oh sure ! But what ' s the speed of dark ?
484,"She was only a Electrician ' s daughter , but she certainly had good connections ."
485,The harm caused by sibling rivalry is relative .
486,"When the woman got paid for being in a study at the sleep clinic , she said it was her dream job ."
487,A carpenter sat on his drill and was bored to tears .
488,A civil question deserves a civil answer .
489,A library should have several floors because it is a multi story building .
490,We don’t read palms ; we wave them .
491,Once a drunkard always a drunkard .
492,Two cooks disagreed but decided to hash it over .
493,Hire teenagers while they still know everything .
494,"The tongue weighs very little , but few people can hold it ."
495,She ' s a composer who has scores of works to her credit .
496,When he fell in the wet concrete he left a bad impression .
497,My name is Herb . I ' m a cook .
498,Who lives by hope will die of hunger .
499,There was a report of shots fired in a local bar . The police don ' t know what triggered the commotion .
500,Take things as you find them .
501,A goat that ate office supplies was on a staple diet .
502,"When the wino suspected his muscatel was watered down , he needed more proof ."
503,"The bargain store promised a free abacus with every purchase , but I wouldn ' t count on it ."
504,Illusionists always find themselves in tricky situations .
505,The orange squeezer was invented with some juicy information .
506,The first chapter of fools is to think themselves wise .
507,"OLD NITPICKERS never die , they just feel lousy ."
508,"Comedians , the biggest joke going ."
509,I ' m ! A ! Graduate ! Of ! The ! Bill ! Shatner ! Acting ! School !
510,Why didn ' t the little boy ask the flight attendant for a snack ? He didn ' t have the nuts .
511,Why did the agricultural presentation go so smoothly ? They planted questions .
512,"I couldn ' t quite remember how to throw a boomerang , but eventually it came back to me ."
513,"OLD FORGERS never die , they just leave no trace ."
514,Speed doesn ' t kill . Stopping very fast kills .
515,When buying a battery you should never have to charge it .
516,"If you want a thing done right , do it yourself ."
517,"Hey , is this yours ? Your dog left it on my lawn . . ."
518,Fretting cares make grey hairs .
519,OLD WRESTLERS never die they just lose their grip .
520,""" Bother , "" said Pooh , as he torched the forest . . . . ."
521,In the office she was frantically looking for her false nails only to discover she had filed them away .
522,He is my friend who grinds at my mill .
523,OLD TEACHERS never die they just lose their class .
524,Gunpowder was invented in a flash .
525,The frog went unnoticed in the milkshake because it blended so well .
526,Sign in an electrician ' s shop : ' We will refuse you . '
527,Do not add oil to the fire .
528,Low carb diets really go against the grain .
529,"Laugh and the world laughs with you , cry and you cry alone ."
530,A wig van blew up on the motorway - police are combing the area .
531,Vegetarian : Indian word for lousy hunter ! ! !
532,Don ' t kill the goose that lays the golden eggs .
533,My name is Sandy . I ' m a lifeguard .
534,He had a difficult time bouncing back from his bungee cord accident .
535,"If ignorance is bliss , why aren ' t there more happy folks ?"
536,Love is blind .
537,A tattle tale pig is a squealer .
538,SHIN : A device for finding furniture in the dark
539,Bike sales go in cycles .
540,"Like father , like son ."
541,A waiter who played tennis was great at serving .
542,An old professor who was never on time died and was called the late professor Brown .
543,Two cooks had a contest and the heat was on .
544,When cave men got together they formed clubs .
545,My friend was fired from his job at the road department for stealing . I have to say I saw it coming . The last time I was at his house all the signs were there .
546,My skiing skills are really going downhill .
547,"Doctor , doctor , I keep thinking I ' m a spoon . - Sit there and don ' t stir . Next ."
548,Baseball is known for its pitched battles .
549,Reassembling the skeletons of prehistoric mammals can be a mammoth undertaking .
550,Life ' s essentials : H O C N Ca P Cl K S Na Mg
551,Math teachers have lots of problems .
552,Graveyard workers really dig their jobs .
553,"I ' m blind enough to look at the situation in the wrong fashion , so I changed my clothes ."
554,"Before he sold Christmas trees , he got himself spruced up ."
555,"OLD SOCCER PLAYERS never die , they just lose their kick ."
556,Golfers hate cake because they might get a slice .
557,Her decision to take up rock climbing was precipitous to say the least .
558,My name is Ray . I ' m a roentgenologist .
559,He gives twice who gives in a trice .
560,A truly wise man never plays leapfrog with a unicorn .
561,There is no smoke without fire .
562,"If pride goes before a fall , humility should arrive by that winter"
563,Put a beggar on horseback and he ' ll ride it to death .
564,The psychiatrist told the genie his emotions were all bottled up .
565,"After they had it out in the boxing ring , they called it square ."
566,Send $ 20 and I will double your IQ or no money back
567,He who lends to the poor gets interest from god
568,"Power corrupts , especially at the electric company ."
569,"OLD PSYCHIATRISTS never die , they just shrink away ."
570,A politician with a bad back needs lots of support .
571,She had two different jobs as a chef which gave her a full plate .
572,OLD MAGICIANS never die they just disappear .
573,Conjoined twins aren ' t the only twins with special connections .
574,The two guys caught drinking battery acid will soon be charged .
575,"OLD SHOEMAKERS never die , they are just given the boot ."
576,The first step to health is to know that we are sick .
577,The exhibitionist went to the store because he heard they were having a flash sale .
578,A baseball player joined the army and did the round of military bases .
579,If word processing a presentation about guns - - be sure to know how to use bullets .
580,"OLD METEOROLOGISTS never die , they just get under the weather ."
581,A case of disappearing bison had police completely buffaloed .
582,Ultimate office automation : networked coffee machines .
583,Any golfer will tell you the gospel truth . Your next shot always depends on the lie .
584,A rolling stone gathers no moss .
585,A tatoo artist has designs on his clients .
586,Dentists practice by going through many drills .
587,"OLD PICKPOCKETS never die , they just steal away ."
588,Curiosity didn ' t kill the cat . I got ' im with the mower !
589,A little boy called his father who made balloons ' pop ' .
590,"The stock market crashes , but Viagra beats the flop ."
591,Plagiarism is the sincerest form of flattery .
592,Three fingers were willing to cooperate but the thumb and forefinger were opposed .
593,Those who build roofs are so inclined .
594,A skier who makes it to the olympics finds that it is all downhill from there .
595,When the human cannonball retired they couldn ' t find a replacement of the right caliber .
596,A horse is a very stable animal .
597,"OLD ESKIMOS never die , they just go cold ."
598,"You really are addicted to soccer , you should think of kicking the habit ."
599,"She was only a Magistrates daughter , but she knew what to do on the bench ."
600,What happens when you get scared half to death . . . . . twice ?
601,The first fish to gather in schools was the grouper .
602,Put your money where your mouth is .
603,I wanted to lose weight so I went to the paint store . I heard I could get thinner there .
604,If all your troubles are melting away watch out for the floods .
605,Justice delayed is justice denied .
606,What ' s good for the goose is good for the gander .
607,"OLD PLAGIARISTS never die , they just steal away ."
608,"I used to be addicted to soap , but I ' m clean now ."
609,"Profanity , the language of computer professionals"
610,If I want your opinion I ' ll beat it out of you !
611,Some cardiologists are heartless .
612,All good things must come to an end .
613,"I went to buy some property with a hill on it , but it was a little steep ."
614,I find that movies about submarines always go down well .
615,"If it ' s obvious , it ' s obviously wrong ."
616,""" WHO CARES where Carmen Sandiego is ? """
617,""" She ' s dead , Jim . Still warm , though . Flip ya for her ? """
618,A racer who was also a golfer really knew how to drive .
619,If you invite an insomniac to your pajama party they will be up for it .
620,Army dentists make a good drill corps .
621,Dermatologists often make rash statements .
622,My name is Bet . I ' m a coupier .
623,A young sailor thought all of the waves were just swell .
624,OLD PROGRAMMERS never die they just go to bits .
625,Give and you might receive . Take and be sure of it .
626,Backups are usually a good thing unless it ' s a sewer .
627,The Vikings landed during thunder and lightning and took the city by storm .
628,"OLD BREAD MEN never die , they just lose their dough ."
629,Seafood operations start out on a small scale .
630,Civil servants named Grant are known as government grants .
631,"Here , you go first , you ' re immune to bullets ."
632,I wish Noah had swatted those two mosquitoes . . . . .
633,We should not expect to find old heads on young shoulders .
634,I might study something at a university that someone once told me about - there is a degree of ambiguity there .
635,When ancient wall sculptors were finished it was a relief .
636,"The hot dog vendor answered , with a tone quite frank ."
637,"OLD MATH PROFESSORS never die , they just use strange expressions ."
638,"When all is said and done , more is said then done ."
639,OLD SEWAGE WORKERS never die they just waste away .
640,A half truth is a whole lie .
641,The thief had a bold plan . He figured he could carry it off .
642,How do they get Teflon to stick to the pans ?
643,OLD SEERS never die they just lose their vision .
644,Where God has a church the devil will have his chapel .
645,"Everyday is a gift from god , that is why it is called the present"
646,A low yield atomic bomb is like being a bit pregnant .
647,There’s no high like the most high .
648,"OLD LAUNDRY WORKERS never die , they just are decreased ."
649,"She was only a Moonshiner ' s daughter , but I love her still ."
650,God cures and the physician takes the fee .
651,A cynic smells flowers and looks for the casket .
652,It takes all sorts of people to make a world .
653,"OLD UNIVERSITY PRESIDENTS never die , they just lose their faculties"
654,"I was going to buy a book on phobias , but I was afraid it wouldn ' t help me ."
655,The aluminum foiled my plans .
656,She was only a Waitress ' s daughter but she sure could dish it out .
657,The hypnotist went out of business because he ran out of suggestions .
658,For class schedules Yoga instructors are flexible .
659,Hockey players are terrible chess players because they are always getting checked .
660,I do a lot of spreadsheets in the office so you can say I ' m excelling at work .
661,He bent over to pick up a sieve and strained himself .
662,"When they told him that his drum couldn ' t be fixed , it didn ' t resonate very well ."
663,"A fisherman tried boxing , but he only threw hooks ."
664,Federal Law prohibits the removal of this tagline
665,Winning candy as a prize is always a sweet victory .
666,"During his lifetime , the composer Bach was a noted success ."
667,"OLD POKER PLAYERS never die , they are just discarded ."
668,Press any key to continue . . Any other key to format hard drive .
669,' ' I can take photographs if I want to ! ' ' Tom snapped .
670,Lightning storms can be very striking .
671,Our bikinis are exciting . They are simply the tops .
672,High on a ladder he saw a beautiful girl below . He fell for her .
673,"When underwear fell in the vat at a beer - makers , a scandal was brewing ."
674,"Pencils could be made with erasers at both ends , but what would be the point ?"
675,Old burglars never die they just steal away .
676,Lumberjacks have to keep problem logs .
677,"My name is Grant , I am a loan officer ."
678,Midwives don ' t like to wear breeches .
679,"She was only a Farmer ' s daughter , but she knew hundreds of ways to fertilize ."
680,Molecules boiling points vary to some degree .
681,A girl a day keeps the wife away .
682,Suicidal twin kills sister by mistake . . . news at 11 !
683,"My name is Joe , an espresso vender"
684,Haste makes waste .
685,Two friends took ropes to school so that they could skip out .
686,Many people need to learn to be happy with the State they are in .
687,Pipe fitters often have high pressure jobs .
688,"' ' I told you not to ride that horse , ' ' Tom nagged ."
689,Coaches usually have a goal in mind .
690,The meat truck took a long time to deliver because of the Jerky ride .
691,Suicide at sea is definitely going overboard .
692,"An exterminator in Idaho announced that he invented a new spray , one application of which will remain effective for a full season . ' ' Of course , ' ' he warned . ' ' I ' ve still got a few bugs to iron out . ' '"
693,Swimmers have to be careful not to get into deep trouble .
694,"OLD RAILROADERS never die , they just derail ."
695,Time flies .
696,The invention of a shirt fastener after the button was a snap .
697,Life after death for evil doers has always been a hot topic .
698,The man who impulsively got a cat despite his allergies later realized that it was a rash decision .
699,"OLD CARD PLAYERS never die , they just fold ."
700,"She was only a Fruit vendor ' s daughter , but , my , she had big melons ."
701,"Walk softly , carry a big stick ."
702,Boyle said he was under too much pressure .
703,The color of the sun in the early morning : rose .
704,Driving on so many turnpikes was taking its toll .
705,"Fool me once , shame on you . Fool me twice , shame on me ."
706,A ham walked out of the hospital and said ' ' I ' m cured ' ' .
707,If you ' re looking for oranges on an apple tree you will have a fruitless search .
708,"First come , first served ."
709,In high school I recall having a beautiful but difficult math teacher . She was easy on the eyes and hard on the pupils !
710,Those with scissors shouldn ' t use cutting words .
711,What ' s the deal with negotiations ?
712,The family elders have relative importance .
713,A skier who loses a race on a cold day will have a frosty disposition .
714,"OLD PROGRAMMERS never die , they just get bugged with life ."
715,"Christians , keep the faith . . . but not from others !"
716,Those who get up at sunrise have many ideas dawn on them .
717,An experienced waiter can give a lot of good tips .
718,Someone who gossips to you will gossip about you .
719,A little greed can get you lots of stuff
720,Every man thinks his own geese swans .
721,"Money is the Root of All Evil . For more info , send $ 10 ."
722,"' ' This must be an aerobics class , ' ' Tom worked out ."
723,Don ' t go between the tree and the bark .
724,Mind your P ' s and Q ' s .
725,The most popular operation for orthopaedic surgeons is upper - leg surgery : very hip .
726,Actors are cast through their good and bad stages .
727,Food for bad dogs is bought by the pound .
728,"My son wanted a scooter . When I told him they are too dangerous , he moped around the house ."
729,"Spare the rod , spoil the child ."
730,"OLD MATHEMATICIANS never die , they just go off on a tangent"
731,A thief fell and broke his leg in wet cement . He became a hardened criminal .
732,A career is a job that takes about 20 more hours a week .
733,Strip mining prevents forest fires .
734,De Broglie waved aside the invitation .
735,"In parking lots , arguments often start from scratch ."
736,Some shoe sales have a good selection to boot .
737,"When the town removed billboards , they told people that ' s how it was designed ."
738,Good eating deserves good drinking .
739,An army officer is a position that some people shoot for .
740,The electrician got his supplies at the outlet store .
741,The lumber company downsized . They got rid of the deadwood .
742,You can ' t have your cake and eat it too .
743,"Waiter , there ' s a fly in my soup ! ' ' I know . It gives you a nice buzz doesn ' t it ? ' '"
744,"Tailors enjoy hanging out in internet fora , as they are full of threads ."
745,Always remember you ' re unique - just like everyone else .
746,"If you make yourself into a doormat , people will wipe their feet on you ."
747,Priests can ' t marry without prior approval .
748,"Old artists never die , they just put things in perspective ."
749,Don ' t put all your eggs in one basket .
750,"Go away , you snake ! Tom rattled off ."
751,"Whom God will destroy , he first make mad ."
752,I never understood why people liked to play soft ball . It ' s a very underhanded thing to do .
753,"Tom was so tired , he lied about his bed ."
754,Home sweet home .
755,"She was only an Artist ' s daughter , but what a crowd she could draw ."
756,The pen is mightier than the sword .
757,"OLD KENTUCKY FRIED CHICKEN FRANCHISERS never die , they just chicken out ."
758,OLD PILOTS never die they just take off .
759,My name is Marshall . I ' m a peace officier .
760,"Goose , gander and gosling are three sounds but one thing ."
761,Astronomers often have their own private viewpoints .
762,"OLD CRICKETERS never die , they just get bowled over ."
763,Smaller babies may be delivered by stork but the heavier ones need a crane .
764,A farmer with a rip in his clothes has an overall problem .
765,"She was only a Dairyman ' s daughter , but what a calf"
766,"Doctor , Doctor , this ointment you gave me makes my arm smart . . - Then rub some on your head ? Next ."
767,It ' s quiet in a bowling alley because you can hear a pin drop .
768,I just got back from a statistical probability conference . It was average .
769,"OLD HIPPIES never die , they just take a trip ."
770,"I finally found a spotter at the gym , it ' s like a huge weight has been lifted off my shoulders ."
771,"If you trust before you try , you may repent before you die ."
772,Tit for tat .
773,Shepherds sometimes have staff meetings .
774,After having a knee dislocated and an elbow fractured in two barroom brawls Bradley should have learned to stay away from those joints .
775,War is too important to be left to the generals .
776,"No one knows where the shoe pinches , but he who wears it ."
777,"OLD AIR CONDITIONER REPAIRMEN never die , they just lose their cool ."
778,To be a successful frequent flier you need a lot of connections .
779,What do they call all that lumber on the Star Trek ' s Enterprise ? Captain ' s log .
780,""" Ummm , trouble with grammar have I ? Yes ! "" - - Yoda"
781,PRESS To test . < click > RELEASE to detonate .
782,After Gus gave his girlfriend a 3 dollar box of chocolates for her birthday he got nothing but snickers .
783,I ' ll hear it from the horse ' s mouth .
784,"Did you hear about the bivalve they called in to interrogate for that big murder investigation ? Apparently , he ' s clammed up ."
785,Don ' t make clothes for a not yet born baby .
786,"At a conference , I unexpectedly encountered the wife of a former client , whom I hadn ' t seen in 20 or more years . ' ' You haven ' t changed ! ' ' she exclaimed . ' ' There ' s plenty of time for that , ' ' I replied . ' ' The dinner isn ' t until this evening . ' '"
787,Changing a tire on that crazy Houston freeway was a wrenching experience .
788,Two podiatrists became arch rivals .
789,"A husband and wife argued over the weather , but it soon blew over ."
790,I needed a raise in my allowance . Mowing the grass all summer just wasn ' t cutting it .
791,I think Santa has riverfront property in Brazil . All our presents came from Amazon this year .
792,Husbands are like fires . They go out when unattended .
793,Success is just a matter of luck . Ask any failure .
794,Counsel is no command .
