,text
1552,"He had to learn what the measles was , from scratch ."
1553,My name is Lute . I ' m a musician .
1554,"She had a boyfriend with a wooden leg , but broke it off ."
1555,One leftover said to another ' foiled again . '
1556,Underpaid weather forecasters predicted a storm of protest .
1557,The painter was hospitalized due to too many strokes .
1558,Trust your calculator . It ' s something to count on .
1559,"When asked by a passenger how high he would get , the pilot replied , ' I don ' t do drugs . '"
1560,The journalist went to Greece to see the ancient ruins and is now writing several columns about them .
1561,The mortician was late for dinner because he was buried in his work .
1562,"OLD RABBIS never die , they just get grey around the temples ."
1563,When the janitor wanted to take up public speaking he always had the floor .
1564,"OLD GUITARISTS never die , they just become unstrung ."
1565,"I before E except after C , huh ? Weird . . . . ."
1566,The date of the marathon was changed . She took it in stride .
1567,Advice most needed is least heeded .
1568,A cutlery manufacturing company was built at a fork in the road .
1569,The man who fell into an upholstery machine is fully recovered .
1570,"( A ) bort , ( R ) etry , ( F ) ail , ( G ) rab _ Hammer"
1571,The longest mile is the last mile home .
1572,People in the desert have dry humor .
1573,"A sign at a cemetery reads , ' No Trespassing , Violators Will Face Grave Charges ' ."
1574,"Where ignorance is bliss , ' tis folly to be wise ."
1575,Time and tide wait for no man .
1576,"Love me , love my dog ."
1577,"For a long time , black holes were a dark secret ."
1578,"She was only a Conductor ' s daughter , but she told you where to get off ."
1579,I ' m not worthless . I can always serve as a bad example .
1580,Forgive and forget .
1581,Don ' t wash your dirty linen in public .
1582,A burnt child dreads the fire .
1583,Cooks have a lot of spice in their lives .
1584,The defendant in a coffee theft trial refused to testify on the grounds that could incriminate him .
1585,"Dorothy ' s dog , of the Wizard of Oz fame , always eats his food entirely - he never leaves any scraps because it ' s in toto ."
1586,"OLD LANDSCAPERS never die , they just get weeded out ."
1587,"In medical school he worried about passing as a surgeon , but he made the cut ."
1588,"A cat found a mysterious sweater , but the mystery was soon unravelled ."
1589,"Notice in a field : The farmer allows walkers to cross the field for free , but the bull charges ."
1590,I didn ' t have the faintest idea as to why I passed out .
1591,I used to work in a blanket factory but it folded .
1592,Rental agents offer quarters for dollars .
1593,The environmentalist rode his bike 20 miles in the morning and 20 more in the evening . He loved recycling .
1594,". . . I multi - task , I read in the bathroom ."
1595,His qualifications as a math teacher didn ' t add up .
1596,"Enjoy the present day , trusting little to what tomorrow may bring ."
1597,There are sins of omission as well as of commission .
1598,"Deeds are fruits , words are but leaves ."
1599,Wade not in unknown waters .
1600,"I forget the dream , but I ' m missing a pajama button . . ."
1601,"She was only a Electrician ' s daughter , and she made house calls to remove her customers ' shorts ."
1602,"Yo mama ' s so ugly , she made an onion cry ."
1603,My name is Sherry . I work in a vineyard .
1604,How could I trust the ceiling fan installer when I knew he was always screwing up .
1605,Politics makes strange bedfellows .
1606,A musician went to hospital after playing too many accidentals .
1607,If you want a metal dog leash go to a chain store .
1608,"If they ever have a contest for the best looking mannequin , there will be stiff competition ."
1609,"Set your drink on a skateboard , they make good coasters ."
1610,"Hey , wake up ! It ' s time for your sleeping pills ."
1611,Procrastination is the thief of time .
1612,A watched pot never boils .
1613,"OLD PHILOSOPHERS never die , they just retire to their own premises ."
1614,People who work at a mint make a lot of money .
1615,"I wanted to join my local rambling club , but the guy I spoke to on the phone just went on and on ."
1616,"She was only a Porchclimber ' s daughter , but you should see her stoop"
1617,"Have an optometrist run for president , because they are people of vision ."
1618,Go with the flow .
1619,She was only a whisky maker but he loved her still .
1620,When the beautician was asked to complete her make - up work she blushed .
1621,"As usual , the chief meteorologist blustered his way through the staff meeting ."
1622,"As you sow , so you reap ."
1623,"OLD BUTCHERS never die , they just get disjointed ."
1624,If you miss a class at beauty school you ' ll need a makeup session .
1625,My name is Bud . I ' m in flowers .
1626,The musician in jail was anxiously awaiting his next release .
1627,The man addicted to brake fluid said he could stop any time .
1628,"OLD WATCHMAKERS never die , they just wind down ."
1629,There ' s many a slip ' twixt cup and lip .
1630,"OLD HACKERS never die , they just go to bits"
1631,"' ' I ' ve got to stop this motor , ' ' Tom choked ."
1632,Reckless youth makes rueful age .
1633,Do unto others as you would have them do unto you .
1634,Even the best bird dog is only good to a point .
1635,"OLD HELICOPTER PILOTS never die , they just lose their choppers ."
1636,The cat took up computer lessons in hopes of mastering its grip on a mouse .
1637,Packing up and relocating to a new home can be a moving experience .
1638,"Love is like war , Easy to start , Hard to end , Impossible to forget ."
1639,"If you can ' t beat them , join them ."
1640,Pick Pockets 50 % Climb Walls 75 % Steal Tagline 99 %
1641,The earless defendant waived his hearing .
1642,A seminar on Time Travel will be held 2 weeks ago . . . .
1643,"Be careful what you wish for , you just might get it ."
1644,The hotel chef was noted for his tomfoolery and his capers .
1645,Sea captains have a lot of latitude .
1646,"OLD LIBRARIANS never die , they just lose their circulation ."
1647,Scientists allow us to see the sun in a different light .
1648,Proverbs run in pairs .
1649,Dentists have the same old grind day after day .
1650,The star asked the sun why the moon was always up so late . Sun responded that it was just a phase .
1651,Erasable pens were a good idea on paper .
1652,If you do research in optics you will have to do some light reading .
1653,"My name is Oscar , and I ' m a movie star ."
1654,For fast relief take two tablets . The ten commandments
1655,"I could not pull out of my parking space , so I used my back up plan ."
1656,Where there are many chickens you can find layers of eggs .
1657,A cow that is pampered too much will give spoiled milk .
1658,"When Irish boys carry their little brothers , they get a Pat on the back ."
1659,He died leaving 100 clocks . His son is winding up the estate .
1660,He bought a donkey because he thought he might get a kick out of it .
1661,The man who dies with the most toys is still dead .
1662,"OLD WATCHMAKERS never die , they just unwind ."
1663,Shit or get off the pot .
1664,Did you hear about the pilot who always had work ? He was great at landing a job .
1665,Do you have any parting words ? - How about comb and brush ?
1666,"Windows isn ' t crippleware : it ' s "" Functionally Challenged """
1667,Network management is like trying to herd cats . . .
1668,Confidence is important ; the computer can sense fear .
1669,Two banks with different rates have a conflict of interest .
1670,When crazy glue was invented lots of people became attached to it .
1671,It ' s a good horse that never stumbles .
1672,There ' s no place like home .
1673,By perseverance the snail reached the arc .
1674,"When the wheel was invented , it caused a revolution ."
1675,"' ' It ' s twelve noon , ' ' Tom chimed in ."
1676,The butcher backed up into the meat grinder and got a little behind in his work .
1677,Beats me why anyone would want to be a masochist .
1678,"Long absent , soon forgotten ."
1679,"OLD CARDIOLOGISTS never die , they just lose heart ."
1680,A friend is best found in adversity .
1681,"After he invented the light bulb , people saw Edison in a new light ."
1682,Don ' t try to reinvent the wheel .
1683,Hell hath no fury like the lawyer of woman scorned !
1684,"OLD ELECTRICIANS never die , they just lose their spark ."
1685,The best way to stop a charging bull is to take away his credit card .
1686,I wanted to exercise last night but it just didn ' t work out .
1687,What ' s another word for Thesaurus ?
1688,Some people with a lot of vision started the Blind Institute .
1689,Everyone ' s fuming over the high cost of gas .
1690,"She told me the drink was non - alcoholic , but where was the proof ?"
1691,During a tennis match one player gave the other a backhanded compliment .
1692,Time will tell .
1693,He auditioned for a part as a trumpet player but he blew it .
1694,Most males in a men ' s room are stand - up guys .
1695,A girl and her boyfriend went to a party as a barcode . They were an item .
1696,There was an eye doctor who wanted to re - locate but couldn ' t find a job because he didn ' t have enough contacts .
1697,"She was only a Fireman ' s daughter , but she ' s really going to blazes ."
1698,"My name is Frank , the Hot - Dog vendor"
1699,"Last week I was diagnosed with insomnia , and now I ' m just so tired of it ."
1700,Musical composers can use lots of Note paper .
1701,Small people are in short supply .
1702,Burning too much incense in a rented room could make the owner incensed .
1703,"For a fish , the end of a barbed hook is the ' ' point ' ' of no return ."
1704,Drumming is not the way to catch a hare .
1705,Give a man a fish and you feed him for a day . Teach a man to fish and you feed him for a lifetime .
1706,Two silk worms had a race . They ended up in a tie .
1707,Semaphore was flagged away as a form of communication decades ago .
1708,A will is a relative thing .
1709,Home is where the heart is .
1710,OLD BEEKEEPERS never die they just buzz off .
1711,I ' d tell you a joke about a cow but I always butcher it .
1712,There ' s a new magnetic steam iron that makes your clothes attractive .
1713,"OLD CASHIERS never die , they just change ."
1714,The police auction was a complete bust .
1715,Joan is as good as my lady in the dark .
1716,The incontinent Scotsman had a wee accident .
1717,Be reasonable . . . . . do it my way .
1718,"My dog has a lot of potential , you just have to unleash it ."
1719,To some - marriage is a word . . . to others - a sentence .
1720,Confidence is the companion of success .
1721,"I ' d love to , but I ' m teaching my ferret to yodel ."
1722,A broken watch is right two times a day .
1723,"Don ' t play with matches . Lighters work much , much better ."
1724,Reward for a job well done : more work .
1725,"Years ago , changing TV channels from a sitting position was a remote possibility ."
1726,Horses eat best when they don ' t have a bit in their mouth .
1727,"I ' ve passed the exam this time , Tom remarked ."
1728,Waiters are good at multiplication because they know their tables .
1729,When he forgot to itemize what he wanted at the grocery store he felt quite listless .
1730,"Two can live as cheaply as one , for half as long ."
1731,I got a small ticket for speeding . It ' s fine with me .
1732,Sharks don ' t eat lawyers . Professional courtesy .
1733,I once had insomnia so bad I was awake until it dawned on me .
1734,Surfing is a swell sport !
1735,Some food for thought is only baloney
1736,Stolen eggs are poached .
1737,He does the work of 3 men . . . . Larry Moe & Curly .
1738,"Professional rock climbers , the only people paid to get high ."
1739,Good girls go to heaven . Bad girls go EVERYwhere .
1740,"I ' m not lost , I ' m "" locationally challenged . """
1741,"When the doctor asked the editor how he was doing , he said he had a problem with his circulation ."
1742,Where there ' s muck there ' s brass .
1743,"I didn ' t understand the math , so the teacher summed it up for me ."
1744,"When in Rome , do as the Romans do ."
1745,Many a mickle makes a muckle .
1746,For a dishonest employee : He ' s an unbelievable worker .
1747,"I wanted to do some research on anorexia , so I went to the library to get the skinny ."
1748,When the spice ships used to bring goods to the king the captain was peppered with compliments .
1749,"OLD ORGANISTS never die , they just come to a stop ."
1750,The only similarity between ancient times and the 1970 ' s is that both were full of people getting stoned .
1751,A cat may look at a king .
1752,What did the triangle say to the circle ? You ' re so pointless .
1753,"I ' m taking this ship back into harbor , Tom reported ."
1754,They call me Pops . I sell soft drinks .
1755,"I tried wrapping Christmas presents , but I didn ' t have the gift ."
1756,"' ' I love hot dogs , ' ' said Tom with relish ."
1757,"In the army mess hall , the men were getting fed up ."
1758,People who eat their apples stem and seed and all improve their core values .
1759,"I met this guy who said he loved children , then I found out he was on parole for it ."
1760,Piano players know what bar they are in .
1761,Two clock makers argued and got ticked off .
1762,Some people take beautiful pictures and cut them into pieces . That ' s a puzzle to me .
1763,"I found out that at the gym , their opinion on fitness carries a lot of weight ."
1764,Great minds agree .
1765,OLD FIREFIGHTERS never die they just go to blazes .
1766,"When a new baby comes into a family , many changes are necessary ."
1767,The royal pharmacist wore a tuxedo and dispensed with formalities .
1768,Never share a foxhole with anyone braver than you are .
1769,A crazy programmer with a cold is a coughing hacker .
1770,Eve taught us it’s okay to take a little ribbing
1771,The only free cheese is in the mouse trap .
1772,The astronomer became an actor because he always wanted to visit the stars .
1773,Hasty judgment leads to repentance .
1774,"OLD GEOLOGISTS never die , they just have their faults"
1775,Take care of number one .
1776,"He ' s dead , Jim . Kick him if you don ' t believe me ."
1777,Meet me at the clothes line . That ' s where I hang out !
1778,Life is what you make of it .
1779,The inventor of shag carpet made a big pile .
1780,I ' ve always pictured myself taking selfies .
1781,"He would promise to play golf , but he didn ' t know how to follow through ."
1782,The artist was great . He could always draw a crowd .
1783,He that steals an egg will steal an ox .
1784,Glue inventors have to stick to it .
1785,He made a slow start in the sport of weightlifting but he picked it up eventually .
1786,The president of a ladder manufacturer had to step down .
1787,"Though thou hast ever so many counsellors , yet do not forsake the counsel of thy own soul ."
1788,Press any key to continue or any other key to quit
1789,A boiled egg in the morning is hard to beat .
1790,Banning the bra was a big flop .
1791,The general started bowling before his aide had entered his name on the score sheet . He had launched a pre - emptive strike .
1792,It is better to die on one ' s feet than live on one ' s knees .
1793,Biscuits and speeches are better when made with shortening .
1794,Biologists have recently produced immortal frogs by removing their vocal cords . They can ' t croak .
1795,Digging a hole for a coffin is a grave matter .
1796,"When the CEO dropped his brownie on the calculator , was he trying to fudge the numbers ?"
1797,Noteworthy musicians are very composed .
1798,Stereo speakers are made by ' high volume ' manufacturers .
1799,Cats remind us that not everything in Nature has purpose .
1800,A karate school restaurant served mainly chops .
1801,You have an important role as a negative example .
1802,For insomnia move to the edge of the bed and you ' ll soon drop off .
1803,"He tried to sell me glass with imperfections in it , but I saw through it ."
1804,Those who make balls of wool for a living like to come home and unwind .
1805,I wondered why the baseball was getting bigger . Then it hit me .
1806,The athlete colored her hair and started a winning streak .
1807,A balding man and his hair are soon parted .
1808,Oil executives are always using crude language .
1809,Fear not the loss of the bell more than the loss of the steeple .
1810,Your E - mail has been returned due to insufficient voltage
1811,"OLD VACUUM CLEANER SALESMEN never die , they just get sucked in !"
1812,When writing out drink recipes you have to have a first draft .
1813,"He worked in a chocolate factory , but always took his sweet time ."
1814,Did you hear about the crab in financial difficulty ? It was starting to feel the pinch .
1815,"A paid up computer is , by definition , obsolete ."
1816,"Actions are usually right , but the reasons seldom are ."
1817,"The enemy of my enemy , is my friend ."
1818,I made a really cheesy pun about quesadillas the other day .
1819,The organizational get together for a company football team was called a kickoff meeting .
1820,He lit the arrow head because he wanted to fire it .
1821,"' ' Don ' t add too much water , ' ' said Tom with great concentration ."
1822,OLD CHAUFFEURS never die they just lose their drive .
1823,Some people still think that writing long stories is a novel idea .
1824,Come huddle with us before the big game
1825,She swallowed a peach seed and could feel it in the pit of her stomach .
1826,WORK HARDER ! . . . Millions on Welfare depend on YOU !
1827,"' ' I like modern painting , ' ' said Tom abstractly ."
1828,Give him an inch and he ' ll take a yard .
1829,The price of the big fan blew me away .
1830,"OLD HOUSEWIVES never die , they just wash away ."
1831,The Biomedical Engineer didn ' t have the heart to check the EKG machine .
1832,"My stuffing was bad , so I got some sage advice ."
1833,Morticians make you feel dead gorgeous .
1834,The janitor ' s union called for sweeping reforms .
1835,He folded and straightened the money because he wanted a tidy sum .
1836,The boy had never played basketball before so he decided to give it a shot .
1837,She was only an Apple - grower ' s daughter but the men said she was delicious .
1838,Double your hard disk space : DELETE WINDOWS !
1839,The hostage said he couldn ' t stay on the phone long because he was tied up at the moment .
1840,"Bring your spirtual Marshmellows , our pastor is on fire !"
1841,Give credit where credit is due .
1842,I tried to look up impotence on the Internet but nothing came up .
1843,The agreeable tennis umpire was generous to a fault .
1844,This tagline no verb .
1845,"' ' I like ragged margins , ' ' said Tom without justification ."
1846,Don ' t open the darkroom door ; it lets all the dark out .
1847,"Old photographers never die , they ' re just out of the picture for a while ."
1848,Arguments about the weather will eventually blow over .
1849,"' ' I don ' t work here on a regular basis , ' ' said Tom casually ."
1850,"OLD FROGS never die , but they do croak ."
1851,What are you taking pictures of ? Tom snapped .
1852,Endorsement by an olympic swimmer caused a company ' s profits to dive .
1853,The cannibal passed his brother in the woods .
1854,Freud could barely repress his excitement .
1855,My word is final ! Tom dictated to his secretary .
1856,It ' s no wonder that some baseball players have lots of money - often even many of the bases are loaded .
1857,Good police officers never miss a beat .
1858,To save money for the company he cut all the electricity . They were soon in the black .
1859,"I try wearing tight jeans , but I can never pull it off ."
1860,"At first I hated my haircut , but now it ' s growing on me ."
1861,"What did the minister say to the underdressed layman ? ' ' No shoes , no shirt , no service ' '"
1862,A sports match was attended by many scores .
1863,You can ' t milk a bull .
1864,"It ' s not the money I want , it ' s the stuff ."
1865,Your very last breath will be a fatal blow .
1866,A true friend does sometime venture to be offensive .
1867,"I ' ll corroborate that again , Tom reproved ."
1868,"Why yes , I - do - work for a unit of the Illuminati ."
1869,"I had an appointment with the chiropractor , but I backed out ."
1870,When the baby bird penned his first novel he was just a fledgling author .
1871,Artificial knees and elbows were developed during a joint project .
1872,"I always believed my body was a prison for me . I was right , in biology I learnt they were made of cells ."
1873,"Sow thin , shear thin ."
1874,I used to hate maths but then I realised decimals have a point .
1875,OLD BASEBALLS never die they just get pitched .
1876,The baseball pitcher ' s retirement was at the end of a wonderful ERA .
1877,The boy who got electrocuted was unable to give a statement because he was still shocked at the incident .
1878,She got fired from the hot dog stand for putting her hair in a bun .
1879,The case against a donut thief was full of holes .
1880,"Sheesh ! You start havin ' fun , and they send the lawyers !"
1881,He that can have patience can have what he will .
1882,"The duck said to the bartender , ' put it on my bill . '"
1883,"While having a hard time water - skiing , the boy commented , ' This is such a drag . '"
1884,When the artist tried to draw a cube he had a mental block .
1885,When the air conditioning failed in the indoor stadium there was a fan protest .
1886,"OLD WOOL COATS never die , they just become mothballed ."
1887,The runaway beer truck barrelled down the freeway after its driver was mugged .
1888,All true wisdom is found on T - shirts . - - And in taglines .
1889,"If it ' s too good to be true , then it probably is ."
1890,Gauss was asked to attend because of his magnetic personality .
1891,A group of physicists is called a nucleus .
1892,Why do we have training bras ? What can we teach them ?
1893,A book called ' Current Trends in Wiring your House ' turned out to be a shocking failure .
1894,False friends are worse than open enemies .
1895,Mason - Dixon Line n . Separates y ' all from youse guys
1896,Last night sex was so good the neighbors lit cigarettes .
1897,Manners maketh the man .
1898,A word spoken is past recalling .
1899,You have the right to remain silent . . . . USE IT !
1900,Fools and their money become popular quickly .
1901,The apple never falls far from the tree .
1902,A hangman will always keep you in the loop .
1903,"We ' re all sitting in the same boat : I fish , you row ."
1904,"' ' I find you guilty , ' ' said the judge with conviction ."
1905,"OLD YACHTSMEN never die , they just keel over ."
1906,"She was only a Lighthouse keeper ' s daughter , but she never went out at night"
1907,Admiration is the daughter of ignorance .
1908,You are confused ; but this is your normal state .
1909,"Live by the sword , die by the sword ."
1910,User : The hardest - to - setup PC peripheral you can buy .
1911,"' ' I will now demonstrate how to dissect a sheep , ' ' delivered Tom ."
1912,You have to fill out many government forms because there are many forms of government .
1913,"Bush says "" No new taxes ! "" , Clinton says , "" No , NEW taxes ! """
1914,The fertiliser business is a growing industry .
1915,Poverty is the reward of idleness .
1916,"OLD SHEET ROCKERS (dry wallers) never die , they just hang around ."
1917,I tried to learn how to drive a stick shift but couldn ' t locate the manual .
1918,Took an hour to bury the cat . Silly thing kept moving . . .
1919,When poker players have to fold they feel a bit discarded .
1920,"I went to a buffet dinner with my neighbor , who is a taxidermist . After such a big meal , I was stuffed ."
1921,Those who iron clothes have a lot of pressing demands .
1922,I think a job as a shoe salesmen would be your best fit .
1923,I kept failing to get a job as a butcher because I couldn ' t just make the cut .
1924,To many girls the word ' marriage ' has a nice ring to it .
1925,A pair of loud twins were stereo speakers .
1926,To be a mountain climber one needs to be in peak condition .
1927,A bible falling apart belongs to someone who isn’t .
1928,If you work in a tire factory you have to get rolling every morning .
1929,The trumpeter blew it while auditioning for the symphony .
1930,An idea is not responsible for fools who believe in it .
1931,When a ladder was stolen from a store the manager said that further steps would be taken .
1932,A high scoring football game can be very offensive .
1933,"She was only a Vacuum salesman ' s daughter , but she knew how to suck !"
1934,Every rose has its thorn .
1935,If you have need of a locksmith he will be your key man .
1936,"Plough deep while sluggards sleep , and you will have corn to sell and keep ."
1937,Massage therapists need a touch of style .
1938,"He ' s not dead , he ' s electroencephalographically challenged"
1939,Politicians get onto the merry - go - round and then put a spin on it .
1940,For a chemist disappointed in an experiment the reaction was on his face .
1941,I was looking for watch batteries but I wound up at a clock shop .
1942,Vertical living is flat dwelling .
1943,"Waiter , my bill please . - How did you find your luncheon , sir ? - With a magnifying glass ."
1944,A lot of kneeling will keep you in good standing
1945,"I just finished reading Newton ' s Principia Mathematica , and found much of it to be rather derivative ."
1946,"' ' I ' m burning aromatic substances , ' ' said Tom , incensed ."
1947,Upon discovering her children playing with matches their mother was flaming mad .
